{
  "$schema": "https://json-schema.org/draft/2020-12/schema",
  "$id": "https://raw.githubusercontent.com/jwildfire/safety.viz/main/src/data/schema/portfolio.json",
  "title": "safety.viz portfolio manifest",
  "description": "The shape of src/data/portfolio.json, and of any chart library's chart list in the same format: the standard domain set a study supplies, and for every chart the domains it reads and the column each of its settings defaults to. Unlike its neighbours in this directory, this is not a chart's data contract; it describes the manifest that sits across all of them. Version 2 adds what lets a second chart library list its charts beside safety.viz's: an entry's library, its group, the named tables its init takes, and whether an unmapped setting is left out. A version-1 document is a version-2 document that uses none of them.",
  "type": "object",
  "required": ["version", "description", "modules"],
  "additionalProperties": false,
  "properties": {
    "$schema": { "type": "string" },
    "version": {
      "type": "integer",
      "enum": [1, 2],
      "description": "Manifest format version; raised when the shape below changes. Version 2 adds library, group, tables and unmappedSettings to an entry, and the groups map."
    },
    "description": { "type": "string", "minLength": 1 },
    "domains": {
      "type": "object",
      "description": "The standard domain set, keyed by domain id. Required in version 1; in version 2 a library's chart list may leave it out, and its charts read the standard set of the app that lists them.",
      "required": ["subject", "ae", "bds", "eg"],
      "additionalProperties": false,
      "properties": {
        "subject": { "$ref": "#/$defs/domain" },
        "ae": { "$ref": "#/$defs/domain" },
        "bds": { "$ref": "#/$defs/domain" },
        "eg": { "$ref": "#/$defs/domain" }
      }
    },
    "groups": {
      "type": "object",
      "description": "Version 2. Groups of charts other than the standard domains, keyed by group id: the label the app lists them under and where among such groups they come. A chart joins one with its entry's group.",
      "propertyNames": {
        "pattern": "^[a-z][a-z0-9-]*$",
        "not": { "enum": ["subject", "ae", "bds", "eg", "other"] }
      },
      "additionalProperties": {
        "type": "object",
        "required": ["label", "order"],
        "additionalProperties": false,
        "properties": {
          "label": {
            "type": "string",
            "minLength": 1,
            "description": "The group's name on its tab."
          },
          "order": {
            "type": "integer",
            "minimum": 0,
            "description": "Where the group comes among the declared groups, lowest first; the standard domains' groups always come first."
          }
        }
      }
    },
    "modules": {
      "type": "object",
      "description": "Every chart, keyed by its module name (for safety.viz, the name of its data schema file).",
      "minProperties": 1,
      "propertyNames": { "pattern": "^[a-z][a-z0-9-]*$" },
      "additionalProperties": { "$ref": "#/$defs/module" }
    }
  },
  "allOf": [
    {
      "if": { "properties": { "version": { "const": 1 } }, "required": ["version"] },
      "then": {
        "required": ["domains"],
        "not": { "required": ["groups"] },
        "properties": {
          "modules": {
            "additionalProperties": {
              "not": {
                "anyOf": [
                  { "required": ["library"] },
                  { "required": ["group"] },
                  { "required": ["tables"] },
                  { "required": ["unmappedSettings"] }
                ]
              }
            }
          }
        }
      }
    }
  ],
  "$defs": {
    "domainId": { "enum": ["subject", "ae", "bds", "eg"] },
    "domain": {
      "type": "object",
      "required": ["label", "grain", "demo", "columns"],
      "additionalProperties": false,
      "properties": {
        "label": { "type": "string", "minLength": 1, "description": "Display name of the domain." },
        "grain": { "type": "string", "minLength": 1, "description": "What one row is." },
        "demo": {
          "type": "string",
          "pattern": "\\.csv$",
          "description": "The vendored demo extract under site/data/ that supplies this domain."
        },
        "columns": {
          "type": "object",
          "description": "The domain's columns, keyed by the default column name the modules expect.",
          "minProperties": 1,
          "additionalProperties": {
            "type": "object",
            "required": ["label", "description"],
            "additionalProperties": false,
            "properties": {
              "label": { "type": "string", "minLength": 1 },
              "description": { "type": "string", "minLength": 1 }
            }
          }
        }
      }
    },
    "module": {
      "type": "object",
      "required": ["export", "title", "domains", "settings"],
      "additionalProperties": false,
      "properties": {
        "library": {
          "type": "string",
          "pattern": "^[a-z][a-z0-9.-]*$",
          "description": "Version 2. The chart library the chart comes from, as the app was handed it: safety.viz when left out of safety.viz's own manifest, and the library a chart list was handed in with when left out of another's."
        },
        "export": {
          "type": "string",
          "pattern": "^[a-z][A-Za-z0-9]*$",
          "description": "The name the chart's factory is exported under in its library's chart collection (for safety.viz, src/main.js)."
        },
        "title": { "type": "string", "minLength": 1 },
        "group": {
          "type": "string",
          "pattern": "^[a-z][a-z0-9-]*$",
          "description": "Version 2. The group the chart is listed under: a key of the manifest's groups, or a standard domain id. Left out, a chart is listed under the first domain it reads."
        },
        "domains": {
          "type": "array",
          "description": "The standard domains the module cannot draw without. Empty only for a module that reads none of them.",
          "items": { "$ref": "#/$defs/domainId" },
          "uniqueItems": true
        },
        "optionalDomains": {
          "type": "array",
          "description": "Standard domains the module uses when supplied.",
          "items": { "$ref": "#/$defs/domainId" },
          "uniqueItems": true
        },
        "externalDomains": {
          "type": "array",
          "description": "Domains the module reads that are outside the standard set, named as its own data schema names them. A module that lists any maps no settings here.",
          "items": { "type": "string", "minLength": 1 },
          "minItems": 1,
          "uniqueItems": true
        },
        "tables": {
          "type": "object",
          "description": "Version 2. The named tables the chart's init takes, when it takes an object of tables rather than one domain's rows: each read from one standard domain, and required or not. An optional table with no file is left out of the object. The required tables' domains are the entry's domains, and the optional ones' its optionalDomains.",
          "minProperties": 1,
          "propertyNames": { "pattern": "^[A-Za-z][A-Za-z0-9_]*$" },
          "additionalProperties": {
            "type": "object",
            "required": ["domain", "required"],
            "additionalProperties": false,
            "properties": {
              "domain": { "$ref": "#/$defs/domainId" },
              "required": {
                "type": "boolean",
                "description": "Whether the chart cannot draw without the table."
              }
            }
          }
        },
        "unmappedSettings": {
          "enum": ["null", "omit"],
          "description": "Version 2. What the chart is passed for a setting with nothing mapped: null, meaning no column, as when this is left out; or nothing at all (omit), for a chart that refuses a null column setting."
        },
        "settings": {
          "type": "object",
          "description": "The module's column-name settings, keyed as in its data schema; a nested setting is written with a dot (color.value_col).",
          "additionalProperties": {
            "type": "object",
            "required": ["domain", "column", "required"],
            "additionalProperties": false,
            "properties": {
              "domain": {
                "description": "The domain the column is read from; a list when the same setting names a column in more than one table.",
                "oneOf": [
                  { "$ref": "#/$defs/domainId" },
                  {
                    "type": "array",
                    "items": { "$ref": "#/$defs/domainId" },
                    "minItems": 2,
                    "uniqueItems": true
                  }
                ]
              },
              "column": {
                "type": ["string", "null"],
                "description": "The manifest column the setting defaults to; null when the module's schema gives the setting no default."
              },
              "required": {
                "type": "boolean",
                "description": "Whether the module's schema lists the setting as required."
              }
            }
          }
        },
        "note": { "type": "string", "minLength": 1 }
      }
    }
  }
}
